{
  "schemaVersion": 1,
  "metadata": { "changeId": "20260830-order-management-tabs", "pageName": "订单管理 Tab 查询列表", "request": "/yipex:page 生成订单管理 Tab 查询列表页面。页面包含全部订单、待付款、已付款、已完成、已取消五个 Tab，每个 Tab 对应不同订单状态。Tab 切换后保留统一的查询区域，查询条件包括订单号、客户名称、支付方式和下单时间。列表展示订单号、客户名称、订单金额、支付状态、下单时间和操作。操作列提供查看详情和取消订单，页面右上角提供新增订单按钮。新增订单完成后返回全部订单 Tab，并刷新列表；查看详情后返回原 Tab 和原查询条件。详情和新增按字段数量自动选择 Modal、Drawer 或独立页面。", "ruleRefs": ["execution/capability-model/page-composition.schema.json", "execution/capability-model/composition-rules.json", "execution/capability-model/data-binding.schema.json", "execution/page-contract-v2.md", "execution/presentation-intent.md"] },
  "ui": { "system": "yipex", "runtime": "yipex-composition", "rendererVersion": 1 },
  "skeleton": "custom-composition", "recipeId": "order-management-tabs-inline-overlays",
  "regions": [
    { "id": "order-list", "type": "content", "capabilities": ["query.basic", "query.dateRange", "table.flat", "table.pagination", "action.confirm", "detail.overlay", "form.overlay"], "config": { "pageSpec": "order-list/page-spec.json", "preview": "order-list/preview.html" } }
  ],
  "bindings": [],
  "transitions": [],
  "states": { "order-list": ["loading", "empty", "error", "permission-denied", "success", "canceling", "detail-overlay", "form-overlay"] },
  "entryHtml": "preview.html"
}
